{
  "id": "process",
  "name": "Process: Technical Brief",
  "description": "One horizontal run of monospace pills joined by arrows, with a caveat below. A numbered list would lose the effect of taking the whole sequence in at a glance.",
  "content_relations": [
    "sequence"
  ],
  "scene_roles": [
    "relationship",
    "map"
  ],
  "density": {
    "max_chars": 300,
    "max_elements": 21
  },
  "slots": {
    "kicker": {
      "type": "text",
      "required": false,
      "hint": "the section name alone in monospace capitals, up to 6 characters; filled automatically from the story chapter, empty when there is none"
    },
    "title": {
      "type": "text",
      "required": true,
      "hint": "the claim of the slide in one sentence, one line of up to 30 characters; *keyword* turns teal"
    },
    "subtitle": {
      "type": "text",
      "required": false,
      "hint": "a lede that says why this slide matters, up to 2 lines and 40 characters per line"
    },
    "step-1": {
      "type": [
        "text",
        "metric"
      ],
      "required": true,
      "hint": "step name, up to 7 characters per line, up to 2 lines"
    },
    "step-2": {
      "type": [
        "text",
        "metric"
      ],
      "required": true,
      "hint": "same as above; leave empty when not needed"
    },
    "step-3": {
      "type": [
        "text",
        "metric"
      ],
      "required": true,
      "hint": "same as above; leave empty when not needed"
    },
    "step-4": {
      "type": [
        "text",
        "metric"
      ],
      "required": true,
      "hint": "same as above; leave empty when not needed"
    },
    "step-5": {
      "type": [
        "text",
        "metric"
      ],
      "required": false,
      "hint": "same as above; leave empty when not needed"
    },
    "step-6": {
      "type": [
        "text",
        "metric"
      ],
      "required": false,
      "hint": "same as above; leave empty when not needed"
    },
    "caveat": {
      "type": "text",
      "required": false,
      "hint": "a caveat or a limit, up to 2 lines; amber is reserved for this"
    },
    "meta": {
      "type": "text",
      "required": false,
      "hint": "footer small print: where this page's facts come from, up to 10 characters; the scaffold fills it from the occasion, so overwrite it per page"
    },
    "page": {
      "type": "text",
      "required": false,
      "hint": "page number, filled automatically (\"01 / 16\")"
    }
  },
  "elements": [
    {
      "id": "kicker",
      "kind": "text"
    },
    {
      "id": "headrule",
      "kind": "shape"
    },
    {
      "id": "title",
      "kind": "text"
    },
    {
      "id": "subtitle",
      "kind": "text"
    },
    {
      "id": "step-1",
      "kind": "text"
    },
    {
      "id": "arrow-1",
      "kind": "shape"
    },
    {
      "id": "step-2",
      "kind": "text"
    },
    {
      "id": "arrow-2",
      "kind": "shape"
    },
    {
      "id": "step-3",
      "kind": "text"
    },
    {
      "id": "arrow-3",
      "kind": "shape"
    },
    {
      "id": "step-4",
      "kind": "text"
    },
    {
      "id": "arrow-4",
      "kind": "shape"
    },
    {
      "id": "step-5",
      "kind": "text"
    },
    {
      "id": "arrow-5",
      "kind": "shape"
    },
    {
      "id": "step-6",
      "kind": "text"
    },
    {
      "id": "caveat",
      "kind": "text"
    },
    {
      "id": "footrule",
      "kind": "shape"
    },
    {
      "id": "meta",
      "kind": "text"
    },
    {
      "id": "progress",
      "kind": "shape"
    },
    {
      "id": "page",
      "kind": "text"
    }
  ],
  "sample": {
    "kicker": {
      "type": "text",
      "value": "DESIGN"
    },
    "meta": {
      "type": "text",
      "value": "docs/system-map.md"
    },
    "page": {
      "type": "text",
      "value": "11 / 16"
    },
    "title": {
      "type": "text",
      "value": "A full health check is six CLI steps"
    },
    "subtitle": {
      "type": "text",
      "value": "Resuming is a seventh subcommand, resume, which picks up where the last page stopped."
    },
    "step-1": {
      "type": "text",
      "value": "preflight"
    },
    "step-2": {
      "type": "text",
      "value": "download"
    },
    "step-3": {
      "type": "text",
      "value": "plan"
    },
    "step-4": {
      "type": "text",
      "value": "run"
    },
    "step-5": {
      "type": "text",
      "value": "aggregate"
    },
    "step-6": {
      "type": "text",
      "value": "export"
    },
    "caveat": {
      "type": "text",
      "value": "⚠️ run does not produce the result file that gets handed over; step 6, export, does, which is why there is run --and-export."
    }
  }
}
