{
  "id": "statement",
  "name": "Statement: blue professional",
  "description": "One claim per slide: the left column is a blue-ruled list of supporting points; across a hairline, the right column holds the tinted claim box, three small stat cells and a supplement. A plain text page would lose the reading direction of evidence on the left, conclusion on the right.",
  "content_relations": [
    "statement",
    "evidence",
    "sequence"
  ],
  "scene_roles": [
    "evidence",
    "relationship",
    "pause"
  ],
  "density": {
    "max_chars": 360,
    "max_elements": 12
  },
  "slots": {
    "kicker": {
      "type": "text",
      "required": false,
      "hint": "chapter label top left, e.g. \"01 — Why\"; numbered automatically by the scaffold when the slides in the story carry a chapter, otherwise left empty"
    },
    "meta": {
      "type": "text",
      "required": false,
      "hint": "rounded tag top right: audience, phase or occasion, up to 10 characters, filled automatically from the first clause of occasion; leave empty when not needed"
    },
    "title": {
      "type": "text",
      "required": true,
      "hint": "the slide's claim in one sentence, up to 2 lines and 26 characters; *keyword* marks an emphasis (blue)"
    },
    "evidence": {
      "type": [
        "list",
        "text"
      ],
      "required": false,
      "hint": "3 to 5 supporting points, up to 2 lines each"
    },
    "body": {
      "type": "text",
      "required": false,
      "hint": "the claim in one sentence, or a quote, up to 3 lines and 50 characters"
    },
    "stat-1": {
      "type": [
        "metric",
        "text"
      ],
      "required": false,
      "hint": "small stat cell: the metric's value is the number, label its caption (up to 8 characters); leave empty when not needed"
    },
    "stat-2": {
      "type": [
        "metric",
        "text"
      ],
      "required": false,
      "hint": "same as above"
    },
    "stat-3": {
      "type": [
        "metric",
        "text"
      ],
      "required": false,
      "hint": "same as above"
    },
    "caption": {
      "type": "text",
      "required": false,
      "hint": "supplement for the right column, up to 2 lines"
    },
    "page": {
      "type": "text",
      "required": false,
      "hint": "page number, filled automatically (\"01 / 08\")"
    }
  },
  "elements": [
    {
      "id": "kicker",
      "kind": "text"
    },
    {
      "id": "meta",
      "kind": "text"
    },
    {
      "id": "title",
      "kind": "text"
    },
    {
      "id": "evidence",
      "kind": "text"
    },
    {
      "id": "split",
      "kind": "shape"
    },
    {
      "id": "body",
      "kind": "text"
    },
    {
      "id": "stat-1",
      "kind": "text"
    },
    {
      "id": "stat-2",
      "kind": "text"
    },
    {
      "id": "stat-3",
      "kind": "text"
    },
    {
      "id": "caption",
      "kind": "text"
    },
    {
      "id": "progress",
      "kind": "shape"
    },
    {
      "id": "page",
      "kind": "text"
    }
  ],
  "sample": {
    "kicker": {
      "type": "text",
      "value": "02 — Where we stand"
    },
    "meta": {
      "type": "text",
      "value": "Quarterly review"
    },
    "page": {
      "type": "text",
      "value": "03 / 10"
    },
    "title": {
      "type": "text",
      "value": "Fix the three that hit delivery; the rest can wait"
    },
    "evidence": {
      "type": "list",
      "items": [
        "A fifth of pages take over three seconds to load, mostly on mobile",
        "Three in ten forms give no feedback after submit, so users submit again",
        "Monitoring watches the servers, not the time users actually wait",
        "No one owns the fix process; the same issue returns to the backlog three times"
      ]
    },
    "body": {
      "type": "text",
      "value": "\"Not every problem is worth fixing now, but these three hit delivery directly.\""
    },
    "stat-1": {
      "type": "metric",
      "value": "20%",
      "label": "Slow pages"
    },
    "stat-2": {
      "type": "metric",
      "value": "30%",
      "label": "Silent forms"
    },
    "stat-3": {
      "type": "metric",
      "value": "3 times",
      "label": "Bounced back"
    },
    "caption": {
      "type": "text",
      "value": "The other twelve are in the appendix, ranked by impact and cost, for next quarter."
    }
  }
}
