{
  "id": "flow-3",
  "name": "Three-party flow: Technical Brief",
  "description": "Three tall panels joined by two arrows, each a monospace role label over what that party does — a handover, not a list of three teams. Cards without arrows would lose the direction the contract flows in.",
  "content_relations": [
    "sequence",
    "comparison"
  ],
  "scene_roles": [
    "relationship",
    "map"
  ],
  "density": {
    "max_chars": 400,
    "max_elements": 14
  },
  "slots": {
    "kicker": {
      "type": "text",
      "required": false,
      "hint": "the section name alone in monospace capitals, up to 6 characters; filled automatically from the story chapter, empty when there is none"
    },
    "title": {
      "type": "text",
      "required": true,
      "hint": "the claim of the slide in one sentence, one line of up to 30 characters; *keyword* turns teal"
    },
    "subtitle": {
      "type": "text",
      "required": false,
      "hint": "a lede that says why this slide matters, up to 2 lines and 40 characters per line"
    },
    "node-1": {
      "type": [
        "text",
        "metric"
      ],
      "required": true,
      "hint": "a party: a metric whose value is the role in monospace (up to 8 characters), label what they do (up to 12 characters) and delta the detail"
    },
    "node-2": {
      "type": [
        "text",
        "metric"
      ],
      "required": true,
      "hint": "same as above"
    },
    "node-3": {
      "type": [
        "text",
        "metric"
      ],
      "required": true,
      "hint": "same as above"
    },
    "caveat": {
      "type": "text",
      "required": false,
      "hint": "a caveat or a limit, up to 2 lines; amber is reserved for this"
    },
    "meta": {
      "type": "text",
      "required": false,
      "hint": "footer small print: where this page's facts come from, up to 10 characters; the scaffold fills it from the occasion, so overwrite it per page"
    },
    "page": {
      "type": "text",
      "required": false,
      "hint": "page number, filled automatically (\"01 / 16\")"
    }
  },
  "elements": [
    {
      "id": "kicker",
      "kind": "text"
    },
    {
      "id": "headrule",
      "kind": "shape"
    },
    {
      "id": "title",
      "kind": "text"
    },
    {
      "id": "subtitle",
      "kind": "text"
    },
    {
      "id": "node-1",
      "kind": "text"
    },
    {
      "id": "arrow-1",
      "kind": "shape"
    },
    {
      "id": "node-2",
      "kind": "text"
    },
    {
      "id": "arrow-2",
      "kind": "shape"
    },
    {
      "id": "node-3",
      "kind": "text"
    },
    {
      "id": "caveat",
      "kind": "text"
    },
    {
      "id": "footrule",
      "kind": "shape"
    },
    {
      "id": "meta",
      "kind": "text"
    },
    {
      "id": "progress",
      "kind": "shape"
    },
    {
      "id": "page",
      "kind": "text"
    }
  ],
  "sample": {
    "kicker": {
      "type": "text",
      "value": "DESIGN"
    },
    "meta": {
      "type": "text",
      "value": "docs/system-map.md"
    },
    "page": {
      "type": "text",
      "value": "11 / 16"
    },
    "title": {
      "type": "text",
      "value": "Three kinds of user, so the format must be a contract"
    },
    "subtitle": {
      "type": "text",
      "value": "Three roles are held together by one contract and nothing else."
    },
    "node-1": {
      "type": "metric",
      "value": "THIS TEAM",
      "label": "Sets the rules, builds the tool",
      "delta": "Decides what is checked and how, and which run conditions get recorded"
    },
    "node-2": {
      "type": "metric",
      "value": "OPERATOR",
      "label": "Runs it from a config",
      "delta": "Executes on the target machine without needing the domain details"
    },
    "node-3": {
      "type": "metric",
      "value": "VIEWER",
      "label": "Reads the format only",
      "delta": "Joins tables by string equality on the key, never by judging the check"
    },
    "caveat": {
      "type": "text",
      "value": "⚠️ The viewer must never guess: a key that differs by one character is a different measurement, not a typo."
    }
  }
}
