{
  "id": "cover",
  "name": "Cover",
  "description": "One claim, one vermilion bar, everything else left blank. A regular title slide would lose the weight of opening with a single sentence.",
  "content_relations": ["statement"],
  "scene_roles": ["hero"],
  "density": { "max_chars": 120, "max_elements": 4 },
  "slots": {
    "kicker": { "type": "text", "required": false, "hint": "occasion or series name, 4 to 10 characters" },
    "title": { "type": "text", "required": true, "hint": "claim headline, 1 to 2 lines" },
    "subtitle": { "type": "text", "required": false, "hint": "one fact that supports the claim" }
  },
  "elements": [
    { "id": "backdrop", "kind": "shape" },
    { "id": "kicker", "kind": "text" },
    { "id": "title", "kind": "text" },
    { "id": "subtitle", "kind": "text" }
  ],
  "sample": {
    "kicker": { "type": "text", "value": "Weekly meeting pitch" },
    "title": { "type": "text", "value": "Where revision time goes" },
    "subtitle": { "type": "text", "value": "Last quarter six decks averaged four rounds; three of them touched only layout." }
  }
}
