{
  "id": "tabs",
  "name": "Tabs: Warm Keynote",
  "description": "Chapter head and lede, then a glass card holding a few tabs, each with its own panel (a list, a table or a paragraph); clicking a tab during playback switches, static rendering shows only the first. Three separate slides would lose the comparison of switching inside the same frame.",
  "content_relations": [
    "list",
    "comparison",
    "evidence"
  ],
  "scene_roles": [
    "evidence",
    "relationship"
  ],
  "density": {
    "max_chars": 320,
    "max_elements": 8
  },
  "slots": {
    "kicker": {
      "type": "text",
      "required": false,
      "hint": "chapter label, e.g. \"01 — Why\"; numbered automatically by the scaffold when the slides in the story carry a chapter, otherwise left empty (an empty label takes the vertical bar with it)"
    },
    "meta": {
      "type": "text",
      "required": false,
      "hint": "pill tag top right: audience, phase or occasion, up to 10 characters, filled automatically from the first clause of occasion; leave empty when not needed"
    },
    "title": {
      "type": "text",
      "required": true,
      "hint": "the claim of the slide in one sentence, up to 2 lines and 24 characters; *keyword* marks an emphasis"
    },
    "subtitle": {
      "type": "text",
      "required": false,
      "hint": "a one-line lede, up to 50 characters"
    },
    "panels": {
      "type": "tabs",
      "required": true,
      "hint": "2 to 5 tabs, labels up to 6 characters; a panel holds 3 to 5 items or a small table; the first panel is what static rendering and QA see"
    },
    "caption": {
      "type": "text",
      "required": false,
      "hint": "a one-line note"
    },
    "page": {
      "type": "text",
      "required": false,
      "hint": "page number pill, filled automatically (\"01 / 08\")"
    }
  },
  "elements": [
    {
      "id": "kicker",
      "kind": "text"
    },
    {
      "id": "meta",
      "kind": "text"
    },
    {
      "id": "title",
      "kind": "text"
    },
    {
      "id": "subtitle",
      "kind": "text"
    },
    {
      "id": "panels",
      "kind": "text"
    },
    {
      "id": "caption",
      "kind": "text"
    },
    {
      "id": "progress",
      "kind": "shape"
    },
    {
      "id": "page",
      "kind": "text"
    }
  ],
  "sample": {
    "kicker": {
      "type": "text",
      "value": "01 — Why"
    },
    "meta": {
      "type": "text",
      "value": "Site owners"
    },
    "page": {
      "type": "text",
      "value": "03 / 08"
    },
    "title": {
      "type": "text",
      "value": "One bundle, three roles, each with its own document"
    },
    "subtitle": {
      "type": "text",
      "value": "operator runs the checks, viewer reads the results, new-platform adds a platform."
    },
    "panels": {
      "type": "tabs",
      "panels": [
        {
          "label": "operator",
          "content": {
            "type": "list",
            "items": [
              "Prepare: run preflight, stop on anything missing",
              "Measure: six fixed steps, can pause and resume",
              "Deliver: only export writes result.json"
            ]
          }
        },
        {
          "label": "viewer",
          "content": {
            "type": "list",
            "items": [
              "Reads only result.json, never the run folder",
              "Four summary tiles, a heatmap, a line chart",
              "The full table sits in the expanded layer"
            ]
          }
        },
        {
          "label": "new-platform",
          "content": {
            "type": "table",
            "header": [
              "What to do",
              "Basis"
            ],
            "rows": [
              [
                "Produce result.json",
                "Result Schema v1"
              ],
              [
                "Pass smoke",
                "The bundle preflight"
              ]
            ]
          }
        }
      ]
    },
    "caption": {
      "type": "text",
      "value": "Click a tab during playback; static mode shows only the first panel."
    }
  }
}
