{
  "id": "quote",
  "name": "Quote: blue professional",
  "description": "A centred quote: a pale blue quotation mark above, bold large type, the source beneath; a thin ring top left and a pale blue dot bottom right. A plain text page would lose the pause.",
  "content_relations": [
    "statement"
  ],
  "scene_roles": [
    "pause",
    "hero",
    "close"
  ],
  "density": {
    "max_chars": 120,
    "max_elements": 9
  },
  "slots": {
    "kicker": {
      "type": "text",
      "required": false,
      "hint": "chapter label top left, e.g. \"01 — Why\"; numbered automatically by the scaffold when the slides in the story carry a chapter, otherwise left empty"
    },
    "meta": {
      "type": "text",
      "required": false,
      "hint": "rounded tag top right: audience, phase or occasion, up to 10 characters, filled automatically from the first clause of occasion; leave empty when not needed"
    },
    "title": {
      "type": "text",
      "required": true,
      "hint": "the quote itself, up to 3 lines and 60 characters; *keyword* turns blue"
    },
    "caption": {
      "type": "text",
      "required": false,
      "hint": "source: who said it and where, one line"
    },
    "page": {
      "type": "text",
      "required": false,
      "hint": "page number, filled automatically (\"01 / 08\")"
    }
  },
  "elements": [
    {
      "id": "kicker",
      "kind": "text"
    },
    {
      "id": "meta",
      "kind": "text"
    },
    {
      "id": "ring",
      "kind": "shape"
    },
    {
      "id": "orb",
      "kind": "shape"
    },
    {
      "id": "mark",
      "kind": "shape"
    },
    {
      "id": "title",
      "kind": "text"
    },
    {
      "id": "caption",
      "kind": "text"
    },
    {
      "id": "progress",
      "kind": "shape"
    },
    {
      "id": "page",
      "kind": "text"
    }
  ],
  "sample": {
    "kicker": {
      "type": "text",
      "value": "03 — Judgement"
    },
    "meta": {
      "type": "text",
      "value": "Principle"
    },
    "title": {
      "type": "text",
      "value": "Fix the *waiting* first, or the features go unused; no one tolerates slow for something new."
    },
    "caption": {
      "type": "text",
      "value": "Product owner, at the quarterly review"
    },
    "page": {
      "type": "text",
      "value": "05 / 10"
    }
  }
}
