{
  "id": "statement",
  "name": "Statement: Warm Keynote",
  "description": "One claim per slide: the chapter head, a lede, and a glass card below holding the supporting list. A text-only slide would lose the weight the card adds by framing the argument.",
  "content_relations": [
    "statement",
    "evidence",
    "sequence"
  ],
  "scene_roles": [
    "evidence",
    "relationship",
    "pause"
  ],
  "density": {
    "max_chars": 320,
    "max_elements": 9
  },
  "slots": {
    "kicker": {
      "type": "text",
      "required": false,
      "hint": "chapter label, e.g. \"01 — Why\"; numbered automatically by the scaffold when the slides in the story carry a chapter, otherwise left empty (an empty label takes the vertical bar with it)"
    },
    "meta": {
      "type": "text",
      "required": false,
      "hint": "pill tag top right: audience, phase or occasion, up to 10 characters, filled automatically from the first clause of occasion; leave empty when not needed"
    },
    "title": {
      "type": "text",
      "required": true,
      "hint": "the claim of the slide in one sentence, up to 2 lines and 24 characters; *keyword* marks an emphasis"
    },
    "body": {
      "type": "text",
      "required": false,
      "hint": "a lede, 1 to 2 lines"
    },
    "evidence": {
      "type": [
        "list",
        "text"
      ],
      "required": false,
      "hint": "3 to 5 supporting points, one line each"
    },
    "page": {
      "type": "text",
      "required": false,
      "hint": "page number pill, filled automatically (\"01 / 08\")"
    }
  },
  "elements": [
    {
      "id": "kicker",
      "kind": "text"
    },
    {
      "id": "meta",
      "kind": "text"
    },
    {
      "id": "title",
      "kind": "text"
    },
    {
      "id": "body",
      "kind": "text"
    },
    {
      "id": "slab",
      "kind": "shape"
    },
    {
      "id": "evidence",
      "kind": "text"
    },
    {
      "id": "progress",
      "kind": "shape"
    },
    {
      "id": "page",
      "kind": "text"
    }
  ],
  "sample": {
    "kicker": {
      "type": "text",
      "value": "01 — Why"
    },
    "meta": {
      "type": "text",
      "value": "Site owners"
    },
    "page": {
      "type": "text",
      "value": "03 / 08"
    },
    "title": {
      "type": "text",
      "value": "The time we spend revising decks goes on layout"
    },
    "body": {
      "type": "text",
      "value": "Last quarter six decks averaged four revision rounds; three of them touched only the layout."
    },
    "evidence": {
      "type": "list",
      "items": [
        "Round one: a new palette",
        "Round two: a new layout",
        "Round three: the content never changed"
      ]
    }
  }
}
