{
  "id": "cards-4",
  "name": "Four axis tiles: Technical Brief",
  "description": "Four narrow tiles, each a monospace key over a large teal number and its value — the axes of a matrix, or four counts that belong together. Four cards of prose would bury the numbers.",
  "content_relations": [
    "list",
    "hierarchy",
    "evidence"
  ],
  "scene_roles": [
    "map",
    "evidence",
    "relationship"
  ],
  "density": {
    "max_chars": 530,
    "max_elements": 13
  },
  "slots": {
    "kicker": {
      "type": "text",
      "required": false,
      "hint": "the section name alone in monospace capitals, up to 6 characters; filled automatically from the story chapter, empty when there is none"
    },
    "title": {
      "type": "text",
      "required": true,
      "hint": "the claim of the slide in one sentence, one line of up to 30 characters; *keyword* turns teal"
    },
    "subtitle": {
      "type": "text",
      "required": false,
      "hint": "a lede that says why this slide matters, up to 2 lines and 40 characters per line"
    },
    "card-1": {
      "type": [
        "text",
        "metric"
      ],
      "required": true,
      "hint": "card: a metric whose value is the short monospace label (up to 6 characters), label the card title (up to 12 characters) and delta the explanation; or a short paragraph; may carry details (the full text that expands when the card is clicked during playback)"
    },
    "card-2": {
      "type": [
        "text",
        "metric"
      ],
      "required": true,
      "hint": "same as above"
    },
    "card-3": {
      "type": [
        "text",
        "metric"
      ],
      "required": false,
      "hint": "same as above"
    },
    "card-4": {
      "type": [
        "text",
        "metric"
      ],
      "required": false,
      "hint": "same as above"
    },
    "caveat": {
      "type": "text",
      "required": false,
      "hint": "a caveat or a limit, up to 2 lines; amber is reserved for this"
    },
    "meta": {
      "type": "text",
      "required": false,
      "hint": "footer small print: where this page's facts come from, up to 10 characters; the scaffold fills it from the occasion, so overwrite it per page"
    },
    "page": {
      "type": "text",
      "required": false,
      "hint": "page number, filled automatically (\"01 / 16\")"
    }
  },
  "elements": [
    {
      "id": "kicker",
      "kind": "text"
    },
    {
      "id": "headrule",
      "kind": "shape"
    },
    {
      "id": "title",
      "kind": "text"
    },
    {
      "id": "subtitle",
      "kind": "text"
    },
    {
      "id": "card-1",
      "kind": "text"
    },
    {
      "id": "card-2",
      "kind": "text"
    },
    {
      "id": "card-3",
      "kind": "text"
    },
    {
      "id": "card-4",
      "kind": "text"
    },
    {
      "id": "caveat",
      "kind": "text"
    },
    {
      "id": "footrule",
      "kind": "shape"
    },
    {
      "id": "meta",
      "kind": "text"
    },
    {
      "id": "progress",
      "kind": "shape"
    },
    {
      "id": "page",
      "kind": "text"
    }
  ],
  "sample": {
    "kicker": {
      "type": "text",
      "value": "DESIGN"
    },
    "meta": {
      "type": "text",
      "value": "docs/system-map.md"
    },
    "page": {
      "type": "text",
      "value": "11 / 16"
    },
    "title": {
      "type": "text",
      "value": "One batch is a matrix of four axes"
    },
    "subtitle": {
      "type": "text",
      "value": "Every cell is one browser, one concurrency step and one page depth."
    },
    "card-1": {
      "type": "metric",
      "value": "5",
      "label": "Browsers",
      "delta": "declared in the config, expanded by the tool"
    },
    "card-2": {
      "type": "metric",
      "value": "3",
      "label": "Concurrency steps",
      "delta": "c1 · c2 · c5: how many visitors at once"
    },
    "card-3": {
      "type": "metric",
      "value": "15",
      "label": "Cells per batch",
      "delta": "5 browsers × 3 concurrency steps"
    },
    "card-4": {
      "type": "metric",
      "value": "6",
      "label": "Depths per cell",
      "delta": "0 · 1 · 2 · 4 · 8 · 16 links deep"
    },
    "caveat": {
      "type": "text",
      "value": "⚠️ Two of the three axes are already columns or rules; the concurrency step is so far only a note on the report's scope."
    }
  }
}
