{
  "id": "cards-2",
  "name": "Two cards: blue professional",
  "description": "Under the title and lede, two wide tinted cards. Use it for two ideas side by side; do not force in a third.",
  "content_relations": [
    "list",
    "evidence",
    "hierarchy"
  ],
  "scene_roles": [
    "map",
    "evidence"
  ],
  "density": {
    "max_chars": 280,
    "max_elements": 8
  },
  "slots": {
    "kicker": {
      "type": "text",
      "required": false,
      "hint": "chapter label top left, e.g. \"01 — Why\"; numbered automatically by the scaffold when the slides in the story carry a chapter, otherwise left empty"
    },
    "meta": {
      "type": "text",
      "required": false,
      "hint": "rounded tag top right: audience, phase or occasion, up to 10 characters, filled automatically from the first clause of occasion; leave empty when not needed"
    },
    "title": {
      "type": "text",
      "required": true,
      "hint": "the slide's claim in one sentence, up to 2 lines and 26 characters; *keyword* marks an emphasis (blue)"
    },
    "subtitle": {
      "type": "text",
      "required": false,
      "hint": "a one-line lede, up to 50 characters"
    },
    "card-1": {
      "type": [
        "text",
        "metric"
      ],
      "required": true,
      "hint": "card: the metric's value is the big number, label the heading, delta the note; or a short paragraph; may carry details (the full content that expands when the card is clicked during playback)"
    },
    "card-2": {
      "type": [
        "text",
        "metric"
      ],
      "required": true,
      "hint": "same as above"
    },
    "page": {
      "type": "text",
      "required": false,
      "hint": "page number, filled automatically (\"01 / 08\")"
    }
  },
  "elements": [
    {
      "id": "kicker",
      "kind": "text"
    },
    {
      "id": "meta",
      "kind": "text"
    },
    {
      "id": "title",
      "kind": "text"
    },
    {
      "id": "subtitle",
      "kind": "text"
    },
    {
      "id": "card-1",
      "kind": "text"
    },
    {
      "id": "card-2",
      "kind": "text"
    },
    {
      "id": "progress",
      "kind": "shape"
    },
    {
      "id": "page",
      "kind": "text"
    }
  ],
  "sample": {
    "kicker": {
      "type": "text",
      "value": "02 — Where we stand"
    },
    "meta": {
      "type": "text",
      "value": "Quarterly review"
    },
    "page": {
      "type": "text",
      "value": "03 / 10"
    },
    "title": {
      "type": "text",
      "value": "Three numbers that tell the quarter's story"
    },
    "subtitle": {
      "type": "text",
      "value": "Fewer slow pages and silent forms than last quarter; issues still bounce back to the backlog."
    },
    "card-1": {
      "type": "metric",
      "value": "−38%",
      "label": "Fewer slow pages",
      "delta": "Home and list pages load in under three seconds again",
      "details": {
        "type": "list",
        "items": [
          "Mobile home: 4.1 s → 2.6 s",
          "List page: 3.8 s → 2.4 s",
          "Lazy-loading images made the difference"
        ]
      }
    },
    "card-2": {
      "type": "metric",
      "value": "12",
      "label": "Forms now give feedback",
      "delta": "Each has a waiting state and a success message after submit"
    }
  }
}
