{
  "id": "chips-2",
  "name": "Two chip sets: Technical Brief",
  "description": "Two panels, each a heading and one line of what decides membership, then the members themselves as monospace chips. A prose list of fifteen field names would be unreadable; chips make the count visible.",
  "content_relations": [
    "list",
    "comparison",
    "hierarchy"
  ],
  "scene_roles": [
    "evidence",
    "relationship"
  ],
  "density": {
    "max_chars": 400,
    "max_elements": 17
  },
  "slots": {
    "kicker": {
      "type": "text",
      "required": false,
      "hint": "the section name alone in monospace capitals, up to 6 characters; filled automatically from the story chapter, empty when there is none"
    },
    "title": {
      "type": "text",
      "required": true,
      "hint": "the claim of the slide in one sentence, one line of up to 30 characters; *keyword* turns teal"
    },
    "subtitle": {
      "type": "text",
      "required": false,
      "hint": "a lede that says why this slide matters, up to 2 lines and 40 characters per line"
    },
    "left-title": {
      "type": "text",
      "required": true,
      "hint": "left set title, up to 16 characters"
    },
    "left-note": {
      "type": "text",
      "required": false,
      "hint": "one line on what decides membership, up to 2 lines"
    },
    "left-items": {
      "type": "list",
      "required": true,
      "hint": "the members as chips, 4 to 9 items, up to 8 characters each"
    },
    "right-title": {
      "type": "text",
      "required": true,
      "hint": "right set title, up to 16 characters"
    },
    "right-note": {
      "type": "text",
      "required": false,
      "hint": "one line on what decides membership, up to 2 lines"
    },
    "right-items": {
      "type": "list",
      "required": true,
      "hint": "the members as accent chips, 4 to 9 items, up to 8 characters each"
    },
    "caveat": {
      "type": "text",
      "required": false,
      "hint": "a caveat or a limit, up to 2 lines; amber is reserved for this"
    },
    "meta": {
      "type": "text",
      "required": false,
      "hint": "footer small print: where this page's facts come from, up to 10 characters; the scaffold fills it from the occasion, so overwrite it per page"
    },
    "page": {
      "type": "text",
      "required": false,
      "hint": "page number, filled automatically (\"01 / 16\")"
    }
  },
  "elements": [
    {
      "id": "kicker",
      "kind": "text"
    },
    {
      "id": "headrule",
      "kind": "shape"
    },
    {
      "id": "title",
      "kind": "text"
    },
    {
      "id": "subtitle",
      "kind": "text"
    },
    {
      "id": "left",
      "kind": "shape"
    },
    {
      "id": "left-title",
      "kind": "text"
    },
    {
      "id": "left-note",
      "kind": "text"
    },
    {
      "id": "left-items",
      "kind": "text"
    },
    {
      "id": "right",
      "kind": "shape"
    },
    {
      "id": "right-title",
      "kind": "text"
    },
    {
      "id": "right-note",
      "kind": "text"
    },
    {
      "id": "right-items",
      "kind": "text"
    },
    {
      "id": "caveat",
      "kind": "text"
    },
    {
      "id": "footrule",
      "kind": "shape"
    },
    {
      "id": "meta",
      "kind": "text"
    },
    {
      "id": "progress",
      "kind": "shape"
    },
    {
      "id": "page",
      "kind": "text"
    }
  ],
  "sample": {
    "kicker": {
      "type": "text",
      "value": "DESIGN"
    },
    "meta": {
      "type": "text",
      "value": "docs/system-map.md"
    },
    "page": {
      "type": "text",
      "value": "11 / 16"
    },
    "title": {
      "type": "text",
      "value": "The comparability key: \"can these be joined\" as one string"
    },
    "subtitle": {
      "type": "text",
      "value": "The key is fifteen parts joined together; if any one differs, a different thing was measured."
    },
    "left-title": {
      "type": "text",
      "value": "Nine for machine, engine and tool"
    },
    "left-note": {
      "type": "text",
      "value": "The 8 GB and 16 GB machines must stay apart, so machine_id is in the key."
    },
    "left-items": {
      "type": "list",
      "items": [
        "platform_id",
        "machine_id",
        "vendor",
        "browser",
        "engine",
        "engine_version",
        "check_path",
        "driver",
        "firmware"
      ]
    },
    "right-title": {
      "type": "text",
      "value": "Six for the check setup"
    },
    "right-note": {
      "type": "text",
      "value": "The test is \"would this flag change the numbers\"."
    },
    "right-items": {
      "type": "list",
      "items": [
        "spec_type",
        "depth",
        "javascript",
        "viewport",
        "throttle",
        "cache"
      ]
    },
    "caveat": {
      "type": "text",
      "value": "⚠️ The key is not finished: \"phase × concurrency\" is still outside the contract, and a viewer built on the current docs will trip over it."
    }
  }
}
